{
  "schemaVersion": 1,
  "cycleId": "cyc_01jbq3x8n5r7t9v2w4y6z8a0c1",
  "candidateId": "cand_01jbq3x8n5r7t9v2w4y6z8a0d1",
  "headSha": "0123456789abcdef0123456789abcdef01234567",
  "producerId": "squirrel-notifier",
  "producerEpoch": 1,
  "sequence": 4,
  "observedAt": "2026-10-24T13:00:00Z",
  "state": "running",
  "holdReason": null,
  "outcome": null,
  "exitCode": null,
  "stopped": false
}
